{
    "$id": "https://raw.githubusercontent.com/ISA-tools/isa-api/master/isatools/resources/schemas/isa_model_version_1_0_schemas/core/investigation_schema.json",
    "$schema": "https://json-schema.org/draft/2020-12/schema",
    "title" : "ISA investigation schema",
    "name" : "ISA Investigation schema",
    "description" : "JSON-schema representing an ISA mode Investigation object",
    "type" : "object",
    "properties" : {
        "@id": { "type": "string", "format": "uri-reference" },
        "@context": { "type": "string", "format": "uri-reference"},
        "@type" : { "type": "string", "enum": ["Investigation"] },
        "filename": { "type" : "string"},
        "identifier" : { "type" : "string" },
        "title" : { "type" : "string"},
        "description" : { "type" : "string"},
        "submissionDate" :  {
            "anyOf": [
                { "type": "string", "format": "date-time"},
                { "type": "string", "format": "date"},
                { "type": "string", "maxLength": 0 }
            ]},
        "publicReleaseDate" : {
            "anyOf": [
                { "type": "string", "format": "date-time"},
                { "type": "string", "format": "date"},
                { "type": "string", "maxLength": 0 }
            ]},
        "ontologySourceReferences" : {
            "type" : "array",
            "items" : {
                "$ref": "ontology_source_reference_schema.json"
            }
        },
        "publications" : {
            "type" : "array",
            "items" : {
                 "$ref": "publication_schema.json"

            }
        },
        "people" : {
            "type" : "array",
            "items" : {
                 "$ref": "person_schema.json"

            }
        },
        "studies" : {
            "type" : "array",
            "items" : {
                 "$ref": "study_schema.json"

            }
        },
        "comments" : {
            "type": "array",
            "items": {
                 "$ref": "comment_schema.json"
            }
        }
    },
    "additionalProperties": false
}