{
  "@id": "#investigation/jasp_sample",
  "@type": "Investigation",
  "filename": "i_investigation.json",
  "identifier": "metacheck-jasp-sample",
  "title": "Statistical results extracted from a JASP file",
  "description": "Result tables extracted from sample.jasp by metacheck, typed with the STATO ontology and serialised as ISA-JSON. One JASP file = one dataset = one Sample; each analysis is a Process on that shared Sample, outputting a Material carrying the STATO-typed result values.",
  "submissionDate": "",
  "publicReleaseDate": "",
  "ontologySourceReferences": [
    {
      "@type": "OntologySourceReference",
      "name": "STATO",
      "description": "Statistical Methods Ontology",
      "file": "http://purl.obolibrary.org/obo/stato.owl",
      "version": "latest_release"
    }
  ],
  "publications": [],
  "people": [],
  "studies": [
    {
      "@id": "#study/jasp_sample",
      "@type": "Study",
      "filename": "s_study.json",
      "identifier": "jasp-sample",
      "title": "sample.jasp",
      "description": "All analyses stored in sample.jasp, run on the single dataset the file contains.",
      "submissionDate": "",
      "publicReleaseDate": "",
      "publications": [],
      "people": [],
      "studyDesignDescriptors": [],
      "protocols": [
        {
          "@id": "#protocol/paired_ttest",
          "@type": "Protocol",
          "name": "Paired Samples T-Test",
          "protocolType": {
            "@type": "OntologyAnnotation",
            "annotationValue": "paired Student's t-test",
            "termSource": "STATO",
            "termAccession": "http://purl.obolibrary.org/obo/STATO_0000156"
          },
          "description": "",
          "uri": "",
          "version": "",
          "parameters": [],
          "components": []
        }
      ],
      "materials": {
        "sources": [
          {
            "@id": "#source/participants",
            "@type": "Source",
            "name": "sample.jasp dataset",
            "characteristics": [],
            "comments": []
          }
        ],
        "samples": [
          {
            "@id": "#sample/dataset",
            "@type": "Sample",
            "name": "sample.jasp analysed data",
            "characteristics": [],
            "factorValues": [],
            "derivesFrom": [ { "@id": "#source/participants" } ],
            "comments": []
          }
        ],
        "otherMaterials": [
          {
            "@id": "#material/result_comparison1",
            "@type": "Material",
            "name": "Paired Samples T-Test: Illusion_score_sync - control_score_sync",
            "type": "Extract Name",
            "characteristics": [
              {
                "@type": "MaterialAttributeValue",
                "category": {
                  "@id": "#characteristic_category/t_statistic",
                  "@type": "MaterialAttribute",
                  "characteristicType": {
                    "@type": "OntologyAnnotation",
                    "annotationValue": "t-statistic",
                    "termSource": "STATO",
                    "termAccession": "http://purl.obolibrary.org/obo/STATO_0000176"
                  }
                },
                "value": 6.9
              },
              {
                "@type": "MaterialAttributeValue",
                "category": {
                  "@id": "#characteristic_category/df",
                  "@type": "MaterialAttribute",
                  "characteristicType": {
                    "@type": "OntologyAnnotation",
                    "annotationValue": "number of degrees of freedom",
                    "termSource": "STATO",
                    "termAccession": "http://purl.obolibrary.org/obo/STATO_0000069"
                  }
                },
                "value": 8
              },
              {
                "@type": "MaterialAttributeValue",
                "category": {
                  "@id": "#characteristic_category/p_value",
                  "@type": "MaterialAttribute",
                  "characteristicType": {
                    "@type": "OntologyAnnotation",
                    "annotationValue": "p-value",
                    "termSource": "STATO",
                    "termAccession": "http://purl.obolibrary.org/obo/STATO_0000700"
                  }
                },
                "value": "< .001"
              },
              {
                "@type": "MaterialAttributeValue",
                "category": {
                  "@id": "#characteristic_category/cohens_d",
                  "@type": "MaterialAttribute",
                  "characteristicType": {
                    "@type": "OntologyAnnotation",
                    "annotationValue": "Cohen's d",
                    "termSource": "STATO",
                    "termAccession": "http://purl.obolibrary.org/obo/STATO_0000618"
                  }
                },
                "value": 2.3
              }
            ],
            "comments": []
          },
          {
            "@id": "#material/result_comparison2",
            "@type": "Material",
            "name": "Paired Samples T-Test: Illusion_score_sync - Illusion_score_async",
            "type": "Extract Name",
            "characteristics": [
              {
                "@type": "MaterialAttributeValue",
                "category": { "@id": "#characteristic_category/t_statistic" },
                "value": 5.047
              },
              {
                "@type": "MaterialAttributeValue",
                "category": { "@id": "#characteristic_category/df" },
                "value": 8
              },
              {
                "@type": "MaterialAttributeValue",
                "category": { "@id": "#characteristic_category/p_value" },
                "value": "< .001"
              },
              {
                "@type": "MaterialAttributeValue",
                "category": { "@id": "#characteristic_category/cohens_d" },
                "value": 1.682
              }
            ],
            "comments": []
          }
        ]
      },
      "processSequence": [
        {
          "@id": "#process/ttest_comparison1",
          "@type": "Process",
          "name": "paired t-test: sync vs control",
          "executesProtocol": { "@id": "#protocol/paired_ttest" },
          "parameterValues": [],
          "inputs": [ { "@id": "#sample/dataset" } ],
          "outputs": [ { "@id": "#material/result_comparison1" } ],
          "comments": []
        },
        {
          "@id": "#process/ttest_comparison2",
          "@type": "Process",
          "name": "paired t-test: sync vs async",
          "executesProtocol": { "@id": "#protocol/paired_ttest" },
          "parameterValues": [],
          "inputs": [ { "@id": "#sample/dataset" } ],
          "outputs": [ { "@id": "#material/result_comparison2" } ],
          "comments": []
        }
      ],
      "assays": [
        {
          "@id": "#assay/jasp_results",
          "@type": "Assay",
          "filename": "a_assay.json",
          "measurementType": {
            "@type": "OntologyAnnotation",
            "annotationValue": "hypothesis testing",
            "termSource": "STATO",
            "termAccession": "http://purl.obolibrary.org/obo/STATO_0000073"
          },
          "technologyType": {
            "@type": "OntologyAnnotation",
            "annotationValue": "",
            "termSource": "",
            "termAccession": ""
          },
          "technologyPlatform": "JASP",
          "dataFiles": [
            {
              "@id": "#data/sample_jasp",
              "@type": "Data",
              "name": "sample.jasp",
              "type": "Derived Data File",
              "comments": []
            }
          ],
          "materials": {
            "samples": [ { "@id": "#sample/dataset" } ],
            "otherMaterials": [
              { "@id": "#material/result_comparison1" },
              { "@id": "#material/result_comparison2" }
            ]
          },
          "characteristicCategories": [],
          "unitCategories": [],
          "processSequence": [],
          "comments": []
        }
      ],
      "factors": [],
      "characteristicCategories": [
        { "@id": "#characteristic_category/t_statistic" },
        { "@id": "#characteristic_category/df" },
        { "@id": "#characteristic_category/p_value" },
        { "@id": "#characteristic_category/cohens_d" }
      ],
      "unitCategories": [],
      "comments": []
    }
  ],
  "comments": []
}
